{
  "schemaVersion": "1.0.0",
  "kind": "vibeedit.composition",
  "id": "beat-synchronized",
  "canvas": {
    "width": 320,
    "height": 180,
    "frameRate": {
      "numerator": 30,
      "denominator": 1
    },
    "backgroundColor": "#101217",
    "audioSampleRate": 48000
  },
  "durationFrames": 108,
  "sources": [
    {
      "id": "source-a",
      "kind": "video",
      "uri": "sources/source-a.mp4",
      "identity": {
        "algorithm": "generated",
        "value": "vibeedit-source-a-v1"
      },
      "durationFrames": 66,
      "license": {
        "status": "generated",
        "commercialOutputAllowed": true,
        "redistributionAllowed": true
      }
    },
    {
      "id": "source-b",
      "kind": "video",
      "uri": "sources/source-b.mp4",
      "identity": {
        "algorithm": "generated",
        "value": "vibeedit-source-b-v1"
      },
      "durationFrames": 54,
      "license": {
        "status": "generated",
        "commercialOutputAllowed": true,
        "redistributionAllowed": true
      }
    },
    {
      "id": "music",
      "kind": "audio",
      "uri": "sources/music.wav",
      "identity": {
        "algorithm": "generated",
        "value": "vibeedit-music-v1"
      },
      "durationFrames": 108,
      "license": {
        "status": "generated",
        "commercialOutputAllowed": true,
        "redistributionAllowed": true
      }
    }
  ],
  "timeline": {
    "tracks": [
      {
        "id": "V1",
        "kind": "video",
        "order": 0,
        "items": [
          {
            "id": "clip-a",
            "kind": "video",
            "placement": {
              "startFrame": 0,
              "durationFrames": 66
            },
            "source": {
              "sourceId": "source-a",
              "inFrame": 0,
              "durationFrames": 66
            },
            "effects": []
          },
          {
            "id": "clip-b",
            "kind": "video",
            "placement": {
              "startFrame": 54,
              "durationFrames": 54
            },
            "source": {
              "sourceId": "source-b",
              "inFrame": 0,
              "durationFrames": 54
            },
            "effects": []
          },
          {
            "id": "beat-crossfade",
            "kind": "transition",
            "placement": {
              "startFrame": 54,
              "durationFrames": 12
            },
            "transitionId": "vibeedit://transition/crossfade",
            "fromItemId": "clip-a",
            "toItemId": "clip-b",
            "params": {
              "curve": "linear"
            },
            "implementationVersion": "0.1.0"
          }
        ]
      },
      {
        "id": "A1",
        "kind": "audio",
        "order": 0,
        "items": [
          {
            "id": "music",
            "kind": "audio",
            "placement": {
              "startFrame": 0,
              "durationFrames": 108
            },
            "source": {
              "sourceId": "music",
              "inFrame": 0,
              "durationFrames": 108
            },
            "role": "music",
            "gainDb": -12,
            "pan": 0,
            "fadeInFrames": 2,
            "fadeOutFrames": 4,
            "effects": []
          },
          {
            "id": "drop-accent",
            "kind": "sound_effect",
            "placement": {
              "startFrame": 60,
              "durationFrames": 12
            },
            "soundEffectId": "vibeedit://sfx/impact-procedural",
            "params": {
              "frequency": 54
            },
            "gainDb": -11,
            "variationSeed": 21,
            "avoidImmediateRepeat": true
          }
        ]
      }
    ]
  },
  "artifacts": {
    "masks": [],
    "tracking": [],
    "analysis": [
      {
        "id": "beats",
        "kind": "beats",
        "artifactUri": "artifacts/beats.json",
        "format": "vibeedit.beats+json",
        "sourceIds": [
          "music"
        ],
        "provenance": {
          "generator": "vibeedit.analysis.analyze_beats",
          "implementationVersion": "0.1.0",
          "parameters": {},
          "sourceIdentities": [
            "vibeedit-generated-example"
          ],
          "cacheKey": "vibeedit-generated-example-v1"
        }
      }
    ]
  },
  "render": {
    "backend": "ffmpeg",
    "output": {
      "uri": "beat-synchronized.mp4",
      "container": "mp4",
      "videoCodec": "h264",
      "audioCodec": "aac",
      "pixelFormat": "yuv420p"
    },
    "deterministic": true
  },
  "verification": {
    "durationFrames": 108,
    "width": 320,
    "height": 180,
    "frameRate": {
      "numerator": 30,
      "denominator": 1
    },
    "hasVideo": true,
    "hasAudio": true,
    "maxDurationDriftFrames": 1
  },
  "provenance": {
    "generator": "vibeedit-example",
    "generatorVersion": "0.1.0",
    "createdAt": "2026-07-13T00:00:00Z",
    "schemaSource": "schema/composition.schema.json",
    "catalogVersion": "0.1.0"
  }
}
