{
  "schemaVersion": "1.0.0",
  "kind": "vibeedit.composition",
  "id": "fan-edit",
  "canvas": {
    "width": 320,
    "height": 180,
    "frameRate": {
      "numerator": 30,
      "denominator": 1
    },
    "backgroundColor": "#101217",
    "audioSampleRate": 48000
  },
  "durationFrames": 108,
  "sources": [
    {
      "id": "source-a",
      "kind": "video",
      "uri": "sources/source-a.mp4",
      "identity": {
        "algorithm": "generated",
        "value": "vibeedit-source-a-v1"
      },
      "durationFrames": 66,
      "license": {
        "status": "generated",
        "commercialOutputAllowed": true,
        "redistributionAllowed": true
      }
    },
    {
      "id": "source-b",
      "kind": "video",
      "uri": "sources/source-b.mp4",
      "identity": {
        "algorithm": "generated",
        "value": "vibeedit-source-b-v1"
      },
      "durationFrames": 54,
      "license": {
        "status": "generated",
        "commercialOutputAllowed": true,
        "redistributionAllowed": true
      }
    }
  ],
  "timeline": {
    "tracks": [
      {
        "id": "V1",
        "kind": "video",
        "order": 0,
        "items": [
          {
            "id": "training",
            "kind": "video",
            "placement": {
              "startFrame": 0,
              "durationFrames": 66
            },
            "source": {
              "sourceId": "source-a",
              "inFrame": 0,
              "durationFrames": 66
            },
            "effects": [
              {
                "id": "stutter",
                "effectId": "vibeedit://effect/random-frame-stutter",
                "enabled": true,
                "params": {
                  "seed": 11,
                  "windowFrames": 3,
                  "intensity": 0.65
                },
                "implementationVersion": "0.1.0"
              }
            ]
          },
          {
            "id": "payoff",
            "kind": "video",
            "placement": {
              "startFrame": 54,
              "durationFrames": 54
            },
            "source": {
              "sourceId": "source-b",
              "inFrame": 0,
              "durationFrames": 54
            },
            "effects": []
          },
          {
            "id": "drop",
            "kind": "transition",
            "placement": {
              "startFrame": 54,
              "durationFrames": 12
            },
            "transitionId": "vibeedit://transition/crossfade",
            "fromItemId": "training",
            "toItemId": "payoff",
            "params": {
              "curve": "linear"
            },
            "implementationVersion": "0.1.0"
          }
        ]
      },
      {
        "id": "A1",
        "kind": "audio",
        "order": 0,
        "items": [
          {
            "id": "setup-hit",
            "kind": "sound_effect",
            "placement": {
              "startFrame": 15,
              "durationFrames": 12
            },
            "soundEffectId": "vibeedit://sfx/impact-procedural",
            "params": {
              "frequency": 84
            },
            "gainDb": -16,
            "variationSeed": 11,
            "avoidImmediateRepeat": true
          },
          {
            "id": "drop-hit",
            "kind": "sound_effect",
            "placement": {
              "startFrame": 60,
              "durationFrames": 12
            },
            "soundEffectId": "vibeedit://sfx/impact-procedural",
            "params": {
              "frequency": 55
            },
            "gainDb": -8,
            "variationSeed": 12,
            "avoidImmediateRepeat": true
          }
        ]
      }
    ]
  },
  "artifacts": {
    "masks": [],
    "tracking": [],
    "analysis": []
  },
  "render": {
    "backend": "ffmpeg",
    "output": {
      "uri": "fan-edit.mp4",
      "container": "mp4",
      "videoCodec": "h264",
      "audioCodec": "aac",
      "pixelFormat": "yuv420p"
    },
    "deterministic": true
  },
  "verification": {
    "durationFrames": 108,
    "width": 320,
    "height": 180,
    "frameRate": {
      "numerator": 30,
      "denominator": 1
    },
    "hasVideo": true,
    "hasAudio": true,
    "maxDurationDriftFrames": 1
  },
  "provenance": {
    "generator": "vibeedit-example",
    "generatorVersion": "0.1.0",
    "createdAt": "2026-07-13T00:00:00Z",
    "schemaSource": "schema/composition.schema.json",
    "catalogVersion": "0.1.0"
  }
}
