{
  "schemaVersion": "1.0.0",
  "kind": "vibeedit.composition",
  "id": "talking-head-captions",
  "title": "Talking-head Captions",
  "canvas": {
    "width": 640,
    "height": 360,
    "frameRate": {
      "numerator": 30,
      "denominator": 1
    },
    "backgroundColor": "#18202b",
    "audioSampleRate": 48000
  },
  "durationFrames": 90,
  "sources": [],
  "timeline": {
    "tracks": []
  },
  "artifacts": {
    "masks": [],
    "tracking": [],
    "analysis": []
  },
  "render": {
    "backend": "mixed",
    "htmlBackend": "chromium",
    "output": {
      "uri": "talking-head-captions.mp4",
      "container": "mp4",
      "videoCodec": "h264",
      "audioCodec": "aac",
      "pixelFormat": "yuv420p"
    },
    "deterministic": true
  },
  "verification": {
    "durationFrames": 90,
    "width": 640,
    "height": 360,
    "frameRate": {
      "numerator": 30,
      "denominator": 1
    },
    "hasVideo": true,
    "hasAudio": true,
    "maxDurationDriftFrames": 1
  },
  "provenance": {
    "generator": "vibeedit-example",
    "generatorVersion": "0.1.0",
    "createdAt": "2026-10-20T00:00:00Z",
    "schemaSource": "schema/composition.schema.json"
  },
  "metadata": {
    "template": {
      "description": "Caption a supplied talking-head clip using source-time words; generated layout stand-in demonstrates editable layers and review persistence.",
      "fixture": "Generated color-motion source and sine tone demonstrate layout, not real quote or transcription quality.",
      "editorialIntent": "Hold the speaker and preserve the sentence; keep captions readable; choose any cutaways only after understanding the supplied quote.",
      "review": "Word layers bind exact source and immutable baseline IDs at initialization."
    }
  }
}
