{
  "schemaVersion": "1.0.0",
  "kind": "vibeedit.composition",
  "id": "basic-generated",
  "canvas": { "width": 640, "height": 360, "frameRate": { "numerator": 30, "denominator": 1 }, "backgroundColor": "#ECFF4D", "audioSampleRate": 48000 },
  "durationFrames": 60,
  "sources": [],
  "timeline": { "tracks": [{ "id": "A1", "kind": "audio", "order": 0, "items": [{ "id": "impact", "kind": "sound_effect", "placement": { "startFrame": 24, "durationFrames": 10 }, "soundEffectId": "vibeedit://sfx/impact-procedural", "params": { "frequency": 72, "decay": 0.18 }, "gainDb": -12, "variationSeed": 7, "avoidImmediateRepeat": true }] }] },
  "artifacts": { "masks": [], "tracking": [], "analysis": [] },
  "cache": { "enabled": true, "namespace": "basic-example", "implementationVersion": "0.1.0", "runtimeVersions": {} },
  "render": { "backend": "ffmpeg", "output": { "uri": "basic-generated.mp4", "container": "mp4", "videoCodec": "h264", "audioCodec": "aac", "pixelFormat": "yuv420p" }, "deterministic": true },
  "verification": { "durationFrames": 60, "width": 640, "height": 360, "frameRate": { "numerator": 30, "denominator": 1 }, "hasVideo": true, "hasAudio": true, "maxDurationDriftFrames": 1 },
  "provenance": { "generator": "vibeedit-example", "generatorVersion": "0.1.0", "createdAt": "2026-07-13T00:00:00Z", "schemaSource": "schema/composition.schema.json", "catalogVersion": "0.1.0" }
}
