{
  "schemaVersion": "1.0.0",
  "kind": "vibeedit.composition",
  "id": "mixed-python-html",
  "title": "Mixed Python and HTML vertical slice",
  "canvas": {
    "width": 640,
    "height": 360,
    "frameRate": { "numerator": 30, "denominator": 1 },
    "backgroundColor": "#101217",
    "audioSampleRate": 48000
  },
  "durationFrames": 90,
  "sources": [],
  "timeline": {
    "tracks": [
      {
        "id": "V1",
        "kind": "video",
        "order": 0,
        "items": []
      },
      {
        "id": "M1",
        "kind": "motion",
        "order": 10,
        "items": [
          {
            "id": "negative-title",
            "kind": "motion",
            "placement": { "startFrame": 0, "durationFrames": 90 },
            "componentId": "vibeedit://text/negative",
            "props": {
              "text": "NO EXCUSES",
              "foreground": "#FFFFFF",
              "background": "#101217"
            },
            "transparent": true,
            "renderer": "html"
          }
        ]
      },
      {
        "id": "A1",
        "kind": "audio",
        "order": 0,
        "items": [
          {
            "id": "impact",
            "kind": "sound_effect",
            "placement": { "startFrame": 30, "durationFrames": 12 },
            "soundEffectId": "vibeedit://sfx/impact-procedural",
            "params": { "frequency": 72, "decay": 0.18 },
            "gainDb": -8,
            "variationSeed": 7,
            "avoidImmediateRepeat": true
          }
        ]
      }
    ]
  },
  "artifacts": {
    "masks": [],
    "tracking": [],
    "analysis": []
  },
  "audio": {
    "targetLufs": -14,
    "truePeakDb": -1,
    "preventImmediateSfxRepeat": true
  },
  "cache": {
    "enabled": true,
    "namespace": "mixed-example",
    "implementationVersion": "0.1.0",
    "runtimeVersions": {}
  },
  "render": {
    "backend": "mixed",
    "htmlBackend": "chromium",
    "output": {
      "uri": "mixed-python-html.mp4",
      "container": "mp4",
      "videoCodec": "h264",
      "audioCodec": "aac",
      "pixelFormat": "yuv420p",
      "transparent": false,
      "quality": { "crf": 18 }
    },
    "deterministic": true
  },
  "verification": {
    "durationFrames": 90,
    "width": 640,
    "height": 360,
    "frameRate": { "numerator": 30, "denominator": 1 },
    "hasVideo": true,
    "hasAudio": true,
    "maxDurationDriftFrames": 1,
    "maxBlackFrameRatio": 0.2,
    "maxSilenceRatio": 0.8
  },
  "provenance": {
    "generator": "vibeedit-example",
    "generatorVersion": "0.1.0",
    "createdAt": "2026-07-13T00:00:00Z",
    "schemaSource": "schema/composition.schema.json",
    "catalogVersion": "0.1.0",
    "skillPackages": ["vibeedit://skill/vibeedit-workspace"]
  }
}
