{
  "schemaVersion": "1.0.0",
  "kind": "vibeedit.composition",
  "id": "transparent-motion-overlay",
  "canvas": {
    "width": 320,
    "height": 180,
    "frameRate": {
      "numerator": 30,
      "denominator": 1
    },
    "backgroundColor": "#101217",
    "audioSampleRate": 48000
  },
  "durationFrames": 60,
  "sources": [],
  "timeline": {
    "tracks": [
      {
        "id": "M1",
        "kind": "motion",
        "order": 0,
        "items": [
          {
            "id": "overlay",
            "kind": "motion",
            "placement": {
              "startFrame": 0,
              "durationFrames": 60
            },
            "componentId": "vibeedit://text/mogrt-fluorscent",
            "props": {
              "text": "ALPHA READY",
              "background": "transparent"
            },
            "renderer": "html",
            "transparent": true
          }
        ]
      }
    ]
  },
  "artifacts": {
    "masks": [],
    "tracking": [],
    "analysis": []
  },
  "render": {
    "backend": "html",
    "output": {
      "uri": "transparent-motion-overlay.webm",
      "container": "webm",
      "videoCodec": "vp9",
      "pixelFormat": "yuva420p",
      "transparent": true
    },
    "deterministic": true
  },
  "verification": {
    "durationFrames": 60,
    "width": 320,
    "height": 180,
    "frameRate": {
      "numerator": 30,
      "denominator": 1
    },
    "hasVideo": true,
    "hasAudio": false,
    "maxDurationDriftFrames": 1
  },
  "provenance": {
    "generator": "vibeedit-example",
    "generatorVersion": "0.1.0",
    "createdAt": "2026-07-13T00:00:00Z",
    "schemaSource": "schema/composition.schema.json",
    "catalogVersion": "0.1.0"
  }
}
